{"generatedAt":"2026-10-31T10:29:31.418Z","weeks":["2026-W19","2026-W20","2026-W21","2026-W22","2026-W23","2026-W24","2026-W25","2026-W26","2026-W27","2026-W28","2026-W29","2026-W30","2026-W31","2026-W32","2026-W33","2026-W34","2026-W35","2026-W36","2026-W37","2026-W38","2026-W39","2026-W40","2026-W41","2026-W42","2026-W43","2026-W44"],"months":["2026-05","2026-06","2026-07","2026-08","2026-09","2026-10"],"recentWeeks":4,"cells":[{"chem":"drug","cs":"ml","count":1515,"countExisting":1492,"countInferred":23,"avgScore":40.7,"maxScore":99,"recent":132,"previous":226,"growth":0.59,"weekly":[54,48,57,78,73,68,59,62,75,59,60,47,73,44,52,48,58,82,70,43,51,62,52,41,22,17],"rising":false,"quietPromising":false,"topIds":["2r27c9l2tc7sl","1ftx0jnp2deah","35po6ywmr2goq","128p29homhboj","2ae8ctavfzlvx","3gur4xiet0yq7","1dketek8426l7","10sy9szuxdiwd"]},{"chem":"solidstate","cs":"ml","count":1368,"countExisting":1350,"countInferred":18,"avgScore":41.9,"maxScore":85,"recent":190,"previous":213,"growth":0.89,"weekly":[43,56,58,60,53,60,48,46,45,49,37,48,79,40,39,36,49,68,42,47,54,70,67,55,46,22],"rising":false,"quietPromising":false,"topIds":["tcmizvxhgleb","320tnw6ow2vvk","2ftvoazvnf5z6","5hap2f8qibp5","r71ktee8yi13","1s7lu7x3vto6d","1ctg244d72ch7","2yff8yvp5qea6"]},{"chem":"biochem","cs":"ml","count":1201,"countExisting":1161,"countInferred":40,"avgScore":37.6,"maxScore":86,"recent":111,"previous":178,"growth":0.63,"weekly":[57,44,47,56,57,48,37,49,72,39,44,52,51,40,35,42,50,53,48,37,40,53,33,34,25,19],"rising":false,"quietPromising":false,"topIds":["2u9le0gghp50m","35po6ywmr2goq","31dir6cffi6ld","chwetcjvd3wh","zqa6xvloju11","s7qncfuhguox","2irqjbhkul7lj","4ri9skj3kod4"]},{"chem":"analytical","cs":"ml","count":957,"countExisting":929,"countInferred":28,"avgScore":36.1,"maxScore":89,"recent":95,"previous":129,"growth":0.74,"weekly":[48,31,41,31,57,49,40,32,45,30,41,29,47,35,31,26,42,46,31,32,15,51,37,25,16,17],"rising":false,"quietPromising":false,"topIds":["341ithzej6j55","2m6i8t6noa6r0","xhescwwwd1dz","3sig19q3llsb3","ty9938cxou57","3nmvpmln84fwk","qww31z3lm979","crp8dg95eoxv"]},{"chem":"computational","cs":"ml","count":775,"countExisting":750,"countInferred":25,"avgScore":37.1,"maxScore":81,"recent":105,"previous":116,"growth":0.91,"weekly":[29,24,29,25,29,28,21,31,36,31,19,32,28,22,27,28,26,52,24,26,26,40,29,26,26,24],"rising":false,"quietPromising":false,"topIds":["2c30uk44080at","2yx4cwgwpvmv0","2kj5fqck1bd1l","1m2bxwj2m2f3k","nin9jfv16qso","39svhfem6s28c","3j811h13pzixp","1g1w6nvkpcqd6"]},{"chem":"computational","cs":"simulation","count":669,"countExisting":666,"countInferred":3,"avgScore":35.6,"maxScore":85,"recent":99,"previous":106,"growth":0.93,"weekly":[28,19,22,23,24,18,19,29,31,23,22,31,25,23,23,17,24,43,23,25,23,35,25,27,27,20],"rising":false,"quietPromising":false,"topIds":["tcmizvxhgleb","5hap2f8qibp5","1ctg244d72ch7","1b1kmg1mid87d","1m2bxwj2m2f3k","nin9jfv16qso","39svhfem6s28c","17ttpnx56x09g"]},{"chem":"solidstate","cs":"simulation","count":639,"countExisting":637,"countInferred":2,"avgScore":40.7,"maxScore":85,"recent":104,"previous":99,"growth":1.05,"weekly":[27,21,26,30,22,19,21,24,17,16,20,24,39,18,17,15,20,33,19,18,29,33,36,29,27,12],"rising":false,"quietPromising":false,"topIds":["tcmizvxhgleb","320tnw6ow2vvk","5hap2f8qibp5","r71ktee8yi13","1s7lu7x3vto6d","1ctg244d72ch7","1b1kmg1mid87d","15soma91lp8vw"]},{"chem":"biochem","cs":"transformer","count":467,"countExisting":457,"countInferred":10,"avgScore":45.8,"maxScore":89,"recent":56,"previous":72,"growth":0.78,"weekly":[24,15,19,19,27,20,20,16,19,17,20,16,21,8,8,13,19,26,8,10,17,37,17,16,16,7],"rising":false,"quietPromising":false,"topIds":["1jah0vjwa9x8w","2u9le0gghp50m","1pzh70jfxp7ew","1ijducz8b1an7","18wzhhjbejqqt","chwetcjvd3wh","24ygrpfp5g7kv","zqa6xvloju11"]},{"chem":"analytical","cs":"vision-spectra","count":466,"countExisting":444,"countInferred":22,"avgScore":38.8,"maxScore":89,"recent":44,"previous":61,"growth":0.73,"weekly":[24,13,19,17,30,23,18,16,19,19,17,11,27,17,16,15,24,22,11,18,9,23,14,11,12,7],"rising":false,"quietPromising":false,"topIds":["341ithzej6j55","811edfiilhqp","xhescwwwd1dz","3sig19q3llsb3","3nmvpmln84fwk","qww31z3lm979","1uvy2jypgqo20","37hde3u10d1gy"]},{"chem":"drug","cs":"transformer","count":398,"countExisting":393,"countInferred":5,"avgScore":51.1,"maxScore":89,"recent":43,"previous":64,"growth":0.68,"weekly":[13,14,11,20,19,20,13,16,14,12,18,15,23,10,9,14,13,24,14,11,15,24,17,7,8,11],"rising":false,"quietPromising":false,"topIds":["1tagwp4ps3to2","1jah0vjwa9x8w","1os859a2rltax","128p29homhboj","2ae8ctavfzlvx","15ldml4g4w0rf","3gur4xiet0yq7","18wzhhjbejqqt"]},{"chem":"biochem","cs":"simulation","count":356,"countExisting":356,"countInferred":0,"avgScore":33.8,"maxScore":75,"recent":43,"previous":55,"growth":0.79,"weekly":[12,11,14,7,14,10,12,17,24,14,13,10,11,13,15,18,15,16,14,11,10,20,12,10,9,12],"rising":false,"quietPromising":false,"topIds":["ty9938cxou57","w44uftpc79cd","1n3pmicq2neyy","zqtganx9la3g","7bwypjpoebgq","3jq8ozqkuc8h6","3nuszs086oo3f","ptfbxmom8bri"]},{"chem":"biochem","cs":"generative","count":348,"countExisting":293,"countInferred":55,"avgScore":41.8,"maxScore":83,"recent":53,"previous":57,"growth":0.93,"weekly":[15,14,19,9,18,21,13,7,10,10,12,11,15,7,8,14,15,8,11,13,13,20,12,21,10,10],"rising":false,"quietPromising":false,"topIds":["1pzh70jfxp7ew","1zo1q2jdh5pwn","31dir6cffi6ld","s7qncfuhguox","25d9fzug45vgz","2liec6zgww7sh","2adgnghsfuke3","2fh3ssehmp26y"]},{"chem":"drug","cs":"generative","count":334,"countExisting":257,"countInferred":77,"avgScore":45.8,"maxScore":83,"recent":53,"previous":47,"growth":1.13,"weekly":[12,10,15,12,17,14,20,13,10,10,13,16,14,11,10,9,7,10,16,7,10,14,12,22,9,10],"rising":false,"quietPromising":false,"topIds":["2iewp2h6rsycc","1zo1q2jdh5pwn","2ae8ctavfzlvx","15ldml4g4w0rf","31dir6cffi6ld","1dketek8426l7","25x3l07z2e4d5","10sy9szuxdiwd"]},{"chem":"drug","cs":"simulation","count":321,"countExisting":321,"countInferred":0,"avgScore":37.5,"maxScore":88,"recent":21,"previous":46,"growth":0.47,"weekly":[11,10,8,13,16,18,10,14,14,13,12,17,14,13,12,15,15,16,14,8,9,15,5,6,4,6],"rising":false,"quietPromising":false,"topIds":["1ftx0jnp2deah","35po6ywmr2goq","18cimpwbwolbc","11eczn07qc4i6","28sbytcne4rek","4vsk4yudfv29","2v2rakrz4hhgb","2ze31d1tc41ua"]},{"chem":"solidstate","cs":"gnn","count":314,"countExisting":282,"countInferred":32,"avgScore":49.5,"maxScore":82,"recent":39,"previous":39,"growth":1,"weekly":[6,19,13,20,10,18,11,11,10,9,7,14,18,6,10,6,15,17,6,8,8,17,16,11,9,3],"rising":false,"quietPromising":false,"topIds":["1s7lu7x3vto6d","1ctg244d72ch7","1c3tmyuk8jzxt","30t7hnz3tdwa2","1tluxioip7a0l","9ys5pc6wl464","24zj3szj3n56m","2kj5fqck1bd1l"]},{"chem":"catalysis","cs":"ml","count":300,"countExisting":297,"countInferred":3,"avgScore":36.7,"maxScore":83,"recent":40,"previous":37,"growth":1.08,"weekly":[8,11,10,10,16,13,9,15,17,15,12,14,15,10,4,7,12,14,5,12,12,8,11,12,8,9],"rising":false,"quietPromising":false,"topIds":["3tw5gznpg4m5s","2n6j6p5ockq4t","2b4iu1am3veds","1sb9k8ma4bsgc","2lsoblci9dlno","351704qii4inp","38o3eb32tu7sj","10yizzw837gyz"]},{"chem":"drug","cs":"gnn","count":294,"countExisting":273,"countInferred":21,"avgScore":53.7,"maxScore":99,"recent":23,"previous":27,"growth":0.86,"weekly":[9,10,14,19,16,23,10,8,14,14,15,17,19,7,9,8,12,13,9,2,10,6,9,5,4,5],"rising":false,"quietPromising":false,"topIds":["2r27c9l2tc7sl","1jah0vjwa9x8w","1ftx0jnp2deah","128p29homhboj","15ldml4g4w0rf","25x3l07z2e4d5","18wzhhjbejqqt","24ygrpfp5g7kv"]},{"chem":"solidstate","cs":"transformer","count":270,"countExisting":270,"countInferred":0,"avgScore":51,"maxScore":85,"recent":39,"previous":45,"growth":0.87,"weekly":[12,8,8,12,12,8,15,12,9,13,7,9,17,7,10,5,8,9,9,8,11,17,14,10,13,2],"rising":false,"quietPromising":false,"topIds":["tcmizvxhgleb","2ftvoazvnf5z6","5tahvkxqmqj5","170qnkfk6byi6","3vzpv5x6laq0k","2yff8yvp5qea6","1b1kmg1mid87d","1ifyffosmk5up"]},{"chem":"solidstate","cs":"generative","count":269,"countExisting":249,"countInferred":20,"avgScore":48.9,"maxScore":86,"recent":33,"previous":51,"growth":0.65,"weekly":[11,11,13,16,14,10,9,9,7,11,10,7,14,8,4,2,9,13,11,9,13,18,11,10,10,2],"rising":false,"quietPromising":false,"topIds":["2zvroeco9d6y5","2iewp2h6rsycc","5tahvkxqmqj5","170qnkfk6byi6","1dketek8426l7","1ifyffosmk5up","9ys5pc6wl464","24zj3szj3n56m"]},{"chem":"energy","cs":"ml","count":221,"countExisting":218,"countInferred":3,"avgScore":34.7,"maxScore":77,"recent":23,"previous":41,"growth":0.57,"weekly":[3,12,11,3,11,10,11,10,4,10,8,5,14,11,8,7,7,7,9,10,8,14,8,4,7,4],"rising":false,"quietPromising":false,"topIds":["2z0er2xo00jil","1h76wh1wsrw7","3ol88yw5vkx47","3czsy0wbns5wm","qsjxn5euw5qa","400t4mhzm7cv","26pivaza7qk5d","12ol3ml12fbrt"]},{"chem":"solidstate","cs":"llm-agent","count":211,"countExisting":211,"countInferred":0,"avgScore":52,"maxScore":80,"recent":23,"previous":40,"growth":0.59,"weekly":[6,11,6,12,9,6,7,6,5,11,5,7,6,8,9,6,10,14,7,12,6,15,5,6,9,3],"rising":false,"quietPromising":false,"topIds":["102s03houwnfs","1v76wbyqi7e1s","2yff8yvp5qea6","1dnkor49z5u20","150khi0ms7kku","1i7brgswhf5hu","3g6g9pu38z3lf","3172ck32icrrt"]},{"chem":"nano","cs":"ml","count":197,"countExisting":193,"countInferred":4,"avgScore":34.9,"maxScore":71,"recent":16,"previous":26,"growth":0.63,"weekly":[6,15,7,8,12,12,6,10,2,13,3,2,16,4,8,7,7,11,4,8,8,6,5,1,4,6],"rising":false,"quietPromising":false,"topIds":["p19welbls611","19c8v0vgvanwx","3lfxleahk0ark","2mkm60gps2jzq","2t7hwwbglurif","3lqq5ype9p0b0","2vuo9bvo8cyh4","218596kkwi2gl"]},{"chem":"polymers","cs":"ml","count":175,"countExisting":172,"countInferred":3,"avgScore":35.1,"maxScore":77,"recent":28,"previous":25,"growth":1.12,"weekly":[2,7,11,11,10,5,6,6,7,2,6,6,6,5,3,1,11,12,8,6,4,7,10,3,6,9],"rising":false,"quietPromising":false,"topIds":["2pn5it285kr06","ogooi2h51idu","3ja7jwdz6ja9l","1peb3fnwg4u63","1mbkbobh2zod2","3b93vuuajrf9r","a9yax0cwoz9q","1vg7sfvict5e1"]},{"chem":"computational","cs":"gnn","count":166,"countExisting":149,"c